{
  "$comment": "SPDX-License-Identifier: Apache-2.0",
  "catalog_version": "1.0.0",
  "catalog_id": "urn:global-ai-governance:agentic-ai-governance:schema-catalog:1.0.0",
  "entries": [
    {
      "schema_file": "governance/claims-register.schema.json",
      "schema_id": "urn:global-ai-governance:agentic-ai-governance:schema:claims-register:1.0.0",
      "artifact_kind": "GOVERNANCE_SCHEMA",
      "artifact_version": "1.0.0",
      "id_strategy": "URN",
      "status": "ACTIVE",
      "introduced_in": "GOVERN",
      "supersedes": null,
      "license": "Apache-2.0",
      "content_sha256": "5bfa2d97b4351c185cfc84074454d1199b0e77e0cdda0dc36d456247c8718be9"
    },
    {
      "schema_file": "governance/prohibited-claims.schema.json",
      "schema_id": "urn:global-ai-governance:agentic-ai-governance:schema:prohibited-claims:1.0.0",
      "artifact_kind": "GOVERNANCE_SCHEMA",
      "artifact_version": "1.0.0",
      "id_strategy": "URN",
      "status": "ACTIVE",
      "introduced_in": "GOVERN",
      "supersedes": null,
      "license": "Apache-2.0",
      "content_sha256": "e200ce42c9663cd6506dc3031799c5ff18f3db77d95d4853d8fe13b57865303e"
    },
    {
      "schema_file": "schemas/action-authority.schema.json",
      "schema_id": "https://raw.githubusercontent.com/GLOBAL-AI-GOVERNANCE/agentic-ai-governance/v0.1.0-alpha.1/schemas/action-authority.schema.json",
      "artifact_kind": "PROTOCOL_SCHEMA",
      "artifact_version": "0.1.0-alpha.1",
      "id_strategy": "TAGGED_RAW_GITHUB",
      "status": "ACTIVE",
      "introduced_in": "v0.1.0-alpha.1",
      "supersedes": null,
      "license": "Apache-2.0",
      "content_sha256": "09a9d349465af91926c9a945485eaf057a9782c2e9edea755fd8c65acc546263"
    },
    {
      "schema_file": "schemas/agent-inventory.schema.json",
      "schema_id": "https://raw.githubusercontent.com/GLOBAL-AI-GOVERNANCE/agentic-ai-governance/v0.1.0-alpha.1/schemas/agent-inventory.schema.json",
      "artifact_kind": "PROTOCOL_SCHEMA",
      "artifact_version": "0.1.0-alpha.1",
      "id_strategy": "TAGGED_RAW_GITHUB",
      "status": "ACTIVE",
      "introduced_in": "v0.1.0-alpha.1",
      "supersedes": null,
      "license": "Apache-2.0",
      "content_sha256": "e37fbf6ae54cfc26202048ba9832bec7d872fa02a95f302a57dd571118767b36"
    },
    {
      "schema_file": "schemas/agent-trust-passport.schema.json",
      "schema_id": "https://raw.githubusercontent.com/GLOBAL-AI-GOVERNANCE/agentic-ai-governance/v0.1.0-alpha.1/schemas/agent-trust-passport.schema.json",
      "artifact_kind": "PROTOCOL_SCHEMA",
      "artifact_version": "0.1.0-alpha.1",
      "id_strategy": "TAGGED_RAW_GITHUB",
      "status": "ACTIVE",
      "introduced_in": "v0.1.0-alpha.1",
      "supersedes": null,
      "license": "Apache-2.0",
      "content_sha256": "f8b9186d15853c8491ae3f419e7266935d7bc1248e3d2d5152d1fd29149ff970"
    },
    {
      "schema_file": "schemas/assessment-result.schema.json",
      "schema_id": "https://raw.githubusercontent.com/GLOBAL-AI-GOVERNANCE/agentic-ai-governance/v0.1.0-alpha.1/schemas/assessment-result.schema.json",
      "artifact_kind": "PROTOCOL_SCHEMA",
      "artifact_version": "0.1.0-alpha.1",
      "id_strategy": "TAGGED_RAW_GITHUB",
      "status": "ACTIVE",
      "introduced_in": "v0.1.0-alpha.1",
      "supersedes": null,
      "license": "Apache-2.0",
      "content_sha256": "155c820d2f9033af290864e8d910706c7ba427ac039639d6071bb5f17d433720"
    },
    {
      "schema_file": "schemas/bundle-manifest.schema.json",
      "schema_id": "https://raw.githubusercontent.com/GLOBAL-AI-GOVERNANCE/agentic-ai-governance/v0.1.0-alpha.1/schemas/bundle-manifest.schema.json",
      "artifact_kind": "PROTOCOL_SCHEMA",
      "artifact_version": "0.1.0-alpha.1",
      "id_strategy": "TAGGED_RAW_GITHUB",
      "status": "ACTIVE",
      "introduced_in": "v0.1.0-alpha.1",
      "supersedes": null,
      "license": "Apache-2.0",
      "content_sha256": "ec484cc7a4d3abb623589a09a4c30b7e05d92960d48c2161e6db74be046a0fad"
    },
    {
      "schema_file": "schemas/common.schema.json",
      "schema_id": "https://raw.githubusercontent.com/GLOBAL-AI-GOVERNANCE/agentic-ai-governance/v0.1.0-alpha.1/schemas/common.schema.json",
      "artifact_kind": "PROTOCOL_SCHEMA",
      "artifact_version": "0.1.0-alpha.1",
      "id_strategy": "TAGGED_RAW_GITHUB",
      "status": "ACTIVE",
      "introduced_in": "v0.1.0-alpha.1",
      "supersedes": null,
      "license": "Apache-2.0",
      "content_sha256": "b76fda4974265e67e7df9e90da4e7080e2337743588152d64d2748f42ab50a92"
    },
    {
      "schema_file": "schemas/control-profile-descriptor.schema.json",
      "schema_id": "https://raw.githubusercontent.com/GLOBAL-AI-GOVERNANCE/agentic-ai-governance/v0.1.0-alpha.1/schemas/control-profile-descriptor.schema.json",
      "artifact_kind": "PROTOCOL_SCHEMA",
      "artifact_version": "0.1.0-alpha.1",
      "id_strategy": "TAGGED_RAW_GITHUB",
      "status": "ACTIVE",
      "introduced_in": "v0.1.0-alpha.1",
      "supersedes": null,
      "license": "Apache-2.0",
      "content_sha256": "ad70578c9fdf07d37cc8d9269c4661547fcbd028cf2a5dea7ca30565d537dfe5"
    },
    {
      "schema_file": "schemas/data-authority-evidence.schema.json",
      "schema_id": "https://raw.githubusercontent.com/GLOBAL-AI-GOVERNANCE/agentic-ai-governance/v0.1.0-alpha.1/schemas/data-authority-evidence.schema.json",
      "artifact_kind": "PROTOCOL_SCHEMA",
      "artifact_version": "0.1.0-alpha.1",
      "id_strategy": "TAGGED_RAW_GITHUB",
      "status": "ACTIVE",
      "introduced_in": "v0.1.0-alpha.1",
      "supersedes": null,
      "license": "Apache-2.0",
      "content_sha256": "057131725866f7be67eee487831875168504dd9ff8b19234ffea468024203625"
    },
    {
      "schema_file": "schemas/fleet-action-request.schema.json",
      "schema_id": "https://raw.githubusercontent.com/GLOBAL-AI-GOVERNANCE/agentic-ai-governance/v0.1.0-alpha.4/schemas/fleet-action-request.schema.json",
      "artifact_kind": "PROTOCOL_SCHEMA",
      "artifact_version": "0.1.0-alpha.4",
      "id_strategy": "TAGGED_RAW_GITHUB",
      "status": "ACTIVE",
      "introduced_in": "v0.1.0-alpha.4",
      "supersedes": null,
      "license": "Apache-2.0",
      "content_sha256": "3867d3e6d90b66880f6a742fbf9a5d595c968ca15a220ab2012df9864d46cc42"
    },
    {
      "schema_file": "schemas/fleet-controls-common.schema.json",
      "schema_id": "https://raw.githubusercontent.com/GLOBAL-AI-GOVERNANCE/agentic-ai-governance/v0.1.0-alpha.4/schemas/fleet-controls-common.schema.json",
      "artifact_kind": "PROTOCOL_SCHEMA",
      "artifact_version": "0.1.0-alpha.4",
      "id_strategy": "TAGGED_RAW_GITHUB",
      "status": "ACTIVE",
      "introduced_in": "v0.1.0-alpha.4",
      "supersedes": null,
      "license": "Apache-2.0",
      "content_sha256": "ed8a12246f47c1988ea3160e2252a99d5a28b451c4e0967635395062e9f9f15d"
    },
    {
      "schema_file": "schemas/fleet-controls-profile.schema.json",
      "schema_id": "https://raw.githubusercontent.com/GLOBAL-AI-GOVERNANCE/agentic-ai-governance/v0.1.0-alpha.4/schemas/fleet-controls-profile.schema.json",
      "artifact_kind": "PROTOCOL_SCHEMA",
      "artifact_version": "0.1.0-alpha.4",
      "id_strategy": "TAGGED_RAW_GITHUB",
      "status": "ACTIVE",
      "introduced_in": "v0.1.0-alpha.4",
      "supersedes": null,
      "license": "Apache-2.0",
      "content_sha256": "ec69c59e159ef4c6d74ae38056c7940601d2ef53bb6c524a958bc7d8ac525f0a"
    },
    {
      "schema_file": "schemas/mcp-inventory.schema.json",
      "schema_id": "https://raw.githubusercontent.com/GLOBAL-AI-GOVERNANCE/agentic-ai-governance/v0.1.0-alpha.1/schemas/mcp-inventory.schema.json",
      "artifact_kind": "PROTOCOL_SCHEMA",
      "artifact_version": "0.1.0-alpha.1",
      "id_strategy": "TAGGED_RAW_GITHUB",
      "status": "ACTIVE",
      "introduced_in": "v0.1.0-alpha.1",
      "supersedes": null,
      "license": "Apache-2.0",
      "content_sha256": "1f5c8adda16a5bc2cafec710f93df4b7d3e61a51569e697ed89ecf6d4942a60d"
    },
    {
      "schema_file": "schemas/passport-suspension-list.schema.json",
      "schema_id": "https://raw.githubusercontent.com/GLOBAL-AI-GOVERNANCE/agentic-ai-governance/v0.1.0-alpha.4/schemas/passport-suspension-list.schema.json",
      "artifact_kind": "PROTOCOL_SCHEMA",
      "artifact_version": "0.1.0-alpha.4",
      "id_strategy": "TAGGED_RAW_GITHUB",
      "status": "ACTIVE",
      "introduced_in": "v0.1.0-alpha.4",
      "supersedes": null,
      "license": "Apache-2.0",
      "content_sha256": "478194e23082d501a97d3ba03bc5855d366ee1a3947043cd13e36c37e90b9d85"
    },
    {
      "schema_file": "schemas/revocation-entry.schema.json",
      "schema_id": "https://raw.githubusercontent.com/GLOBAL-AI-GOVERNANCE/agentic-ai-governance/v0.1.0-alpha.1/schemas/revocation-entry.schema.json",
      "artifact_kind": "PROTOCOL_SCHEMA",
      "artifact_version": "0.1.0-alpha.1",
      "id_strategy": "TAGGED_RAW_GITHUB",
      "status": "ACTIVE",
      "introduced_in": "v0.1.0-alpha.1",
      "supersedes": null,
      "license": "Apache-2.0",
      "content_sha256": "772673a7b0154640a745829e18dca381e0803f143a2d8278758cf4555f22900c"
    },
    {
      "schema_file": "schemas/revocation-list.schema.json",
      "schema_id": "https://raw.githubusercontent.com/GLOBAL-AI-GOVERNANCE/agentic-ai-governance/v0.1.0-alpha.1/schemas/revocation-list.schema.json",
      "artifact_kind": "PROTOCOL_SCHEMA",
      "artifact_version": "0.1.0-alpha.1",
      "id_strategy": "TAGGED_RAW_GITHUB",
      "status": "ACTIVE",
      "introduced_in": "v0.1.0-alpha.1",
      "supersedes": null,
      "license": "Apache-2.0",
      "content_sha256": "359c72860859732bc8c1948d4aba40427fb31609fa7fd3b997f0371e1229516d"
    },
    {
      "schema_file": "schemas/schema-catalog.schema.json",
      "schema_id": "urn:global-ai-governance:agentic-ai-governance:schema:schema-catalog:1.0.0",
      "artifact_kind": "GOVERNANCE_SCHEMA",
      "artifact_version": "1.0.0",
      "id_strategy": "URN",